{
  "$schema": "https://json-schema.org/draft/2020-12/schema",
  "additionalProperties": false,
  "properties": {
    "completedAt": {
      "anyOf": [
        {
          "description": "ISO-8601 UTC",
          "pattern": "^\\d{4}-\\d{2}-\\d{2}T\\d{2}:\\d{2}:\\d{2}(?:\\.\\d+)?Z$",
          "type": "string"
        },
        {
          "type": "null"
        }
      ]
    },
    "createdAt": {
      "description": "ISO-8601 UTC",
      "pattern": "^\\d{4}-\\d{2}-\\d{2}T\\d{2}:\\d{2}:\\d{2}(?:\\.\\d+)?Z$",
      "type": "string"
    },
    "error": {
      "anyOf": [
        {
          "additionalProperties": false,
          "properties": {
            "code": {
              "minLength": 1,
              "type": "string"
            },
            "message": {
              "minLength": 1,
              "type": "string"
            }
          },
          "required": [
            "code",
            "message"
          ],
          "type": "object"
        },
        {
          "type": "null"
        }
      ]
    },
    "executionDurationMs": {
      "anyOf": [
        {
          "minimum": 0,
          "type": "integer"
        },
        {
          "type": "null"
        }
      ]
    },
    "jobId": {
      "pattern": "^[0-9a-f]{8}-[0-9a-f]{4}-[1-5][0-9a-f]{3}-[89ab][0-9a-f]{3}-[0-9a-f]{12}$",
      "type": "string"
    },
    "pipeline": {
      "enum": [
        "STT_TRANSCRIPTION",
        "SPEECH_CHARACTERISTICS",
        "STT_AND_SPEECH"
      ],
      "type": "string"
    },
    "queueWaitMs": {
      "anyOf": [
        {
          "minimum": 0,
          "type": "integer"
        },
        {
          "type": "null"
        }
      ]
    },
    "queuedAt": {
      "description": "ISO-8601 UTC",
      "pattern": "^\\d{4}-\\d{2}-\\d{2}T\\d{2}:\\d{2}:\\d{2}(?:\\.\\d+)?Z$",
      "type": "string"
    },
    "resultAvailable": {
      "type": "boolean"
    },
    "sessionId": {
      "pattern": "^SES_\\d{6}$",
      "type": "string"
    },
    "startedAt": {
      "anyOf": [
        {
          "description": "ISO-8601 UTC",
          "pattern": "^\\d{4}-\\d{2}-\\d{2}T\\d{2}:\\d{2}:\\d{2}(?:\\.\\d+)?Z$",
          "type": "string"
        },
        {
          "type": "null"
        }
      ]
    },
    "status": {
      "enum": [
        "QUEUED",
        "RUNNING",
        "SUCCEEDED",
        "SUCCEEDED_WITH_WARNINGS",
        "FAILED"
      ],
      "type": "string"
    },
    "totalDurationMs": {
      "anyOf": [
        {
          "minimum": 0,
          "type": "integer"
        },
        {
          "type": "null"
        }
      ]
    },
    "updatedAt": {
      "description": "ISO-8601 UTC",
      "pattern": "^\\d{4}-\\d{2}-\\d{2}T\\d{2}:\\d{2}:\\d{2}(?:\\.\\d+)?Z$",
      "type": "string"
    },
    "warnings": {
      "items": {
        "additionalProperties": false,
        "properties": {
          "answerId": {
            "anyOf": [
              {
                "pattern": "^ANS_\\d{6}$",
                "type": "string"
              },
              {
                "type": "null"
              }
            ]
          },
          "code": {
            "minLength": 1,
            "type": "string"
          },
          "message": {
            "minLength": 1,
            "type": "string"
          },
          "reviewRequired": {
            "type": "boolean"
          }
        },
        "required": [
          "code",
          "message",
          "answerId",
          "reviewRequired"
        ],
        "type": "object"
      },
      "type": "array"
    }
  },
  "required": [
    "jobId",
    "sessionId",
    "pipeline",
    "status",
    "createdAt",
    "queuedAt",
    "startedAt",
    "completedAt",
    "updatedAt",
    "queueWaitMs",
    "executionDurationMs",
    "totalDurationMs",
    "resultAvailable",
    "warnings",
    "error"
  ],
  "title": "Analysis Job Response",
  "type": "object"
}
